{
	"items": [
		{
			"FromCurrency": "USD",
			"ToCurrency": "INR",
			"UserConversionType": "Corporate",
			"ConversionDate": "2020-10-01",
			"ConversionRate": 70
		},
		{
			"FromCurrency": "USD",
			"ToCurrency": "INR",
			"UserConversionType": "Corporate",
			"ConversionDate": "2020-10-02",
			"ConversionRate": 70
		},
		{
			"FromCurrency": "USD",
			"ToCurrency": "INR",
			"UserConversionType": "Corporate",
			"ConversionDate": "2020-10-03",
			"ConversionRate": 70
		},
		{
			"FromCurrency": "USD",
			"ToCurrency": "INR",
			"UserConversionType": "Corporate",
			"ConversionDate": "2020-10-04",
			"ConversionRate": 70
		},
		{
			"FromCurrency": "USD",
			"ToCurrency": "INR",
			"UserConversionType": "Corporate",
			"ConversionDate": "2020-10-05",
			"ConversionRate": 70
		},
		{
			"FromCurrency": "USD",
			"ToCurrency": "INR",
			"UserConversionType": "Corporate",
			"ConversionDate": "2020-10-06",
			"ConversionRate": 70
		},
		{
			"FromCurrency": "USD",
			"ToCurrency": "INR",
			"UserConversionType": "Corporate",
			"ConversionDate": "2020-10-07",
			"ConversionRate": 70
		},
		{
			"FromCurrency": "USD",
			"ToCurrency": "INR",
			"UserConversionType": "Corporate",
			"ConversionDate": "2020-10-08",
			"ConversionRate": 70
		},
		{
			"FromCurrency": "USD",
			"ToCurrency": "INR",
			"UserConversionType": "Corporate",
			"ConversionDate": "2020-10-09",
			"ConversionRate": 70
		},
		{
			"FromCurrency": "USD",
			"ToCurrency": "INR",
			"UserConversionType": "Corporate",
			"ConversionDate": "2020-10-10",
			"ConversionRate": 70
		},
		{
			"FromCurrency": "USD",
			"ToCurrency": "INR",
			"UserConversionType": "Corporate",
			"ConversionDate": "2020-10-11",
			"ConversionRate": 70
		},
		{
			"FromCurrency": "USD",
			"ToCurrency": "INR",
			"UserConversionType": "Corporate",
			"ConversionDate": "2020-10-12",
			"ConversionRate": 70
		},
		{
			"FromCurrency": "USD",
			"ToCurrency": "INR",
			"UserConversionType": "Corporate",
			"ConversionDate": "2020-10-13",
			"ConversionRate": 70
		},
		{
			"FromCurrency": "USD",
			"ToCurrency": "INR",
			"UserConversionType": "Corporate",
			"ConversionDate": "2020-10-14",
			"ConversionRate": 70
		},
		{
			"FromCurrency": "USD",
			"ToCurrency": "INR",
			"UserConversionType": "Corporate",
			"ConversionDate": "2020-10-15",
			"ConversionRate": 70
		},
		{
			"FromCurrency": "USD",
			"ToCurrency": "INR",
			"UserConversionType": "Corporate",
			"ConversionDate": "2020-10-16",
			"ConversionRate": 70
		},
		{
			"FromCurrency": "USD",
			"ToCurrency": "INR",
			"UserConversionType": "Corporate",
			"ConversionDate": "2020-10-17",
			"ConversionRate": 70
		},
		{
			"FromCurrency": "USD",
			"ToCurrency": "INR",
			"UserConversionType": "Corporate",
			"ConversionDate": "2020-10-18",
			"ConversionRate": 70
		},
		{
			"FromCurrency": "USD",
			"ToCurrency": "INR",
			"UserConversionType": "Corporate",
			"ConversionDate": "2020-10-19",
			"ConversionRate": 70
		},
		{
			"FromCurrency": "USD",
			"ToCurrency": "INR",
			"UserConversionType": "Corporate",
			"ConversionDate": "2020-10-20",
			"ConversionRate": 70
		},
		{
			"FromCurrency": "USD",
			"ToCurrency": "INR",
			"UserConversionType": "Corporate",
			"ConversionDate": "2020-10-21",
			"ConversionRate": 70
		},
		{
			"FromCurrency": "USD",
			"ToCurrency": "INR",
			"UserConversionType": "Corporate",
			"ConversionDate": "2020-10-22",
			"ConversionRate": 70
		},
		{
			"FromCurrency": "USD",
			"ToCurrency": "INR",
			"UserConversionType": "Corporate",
			"ConversionDate": "2020-10-23",
			"ConversionRate": 70
		},
		{
			"FromCurrency": "USD",
			"ToCurrency": "INR",
			"UserConversionType": "Corporate",
			"ConversionDate": "2020-10-24",
			"ConversionRate": 70
		},
		{
			"FromCurrency": "USD",
			"ToCurrency": "INR",
			"UserConversionType": "Corporate",
			"ConversionDate": "2020-10-25",
			"ConversionRate": 70
		}
	],
	"count": 25,
	"hasMore": true,
	"limit": 25,
	"offset": 0,
	"links": [
		{
			"rel": "self",
			"href": "https://fa-epnz-dev1-saasfaprod1.fa.ocs.oraclecloud.com:443/fscmRestApi/resources/11.13.18.05/currencyRates",
			"name": "currencyRates",
			"kind": "collection"
		}
	]
}